[
  {
    "slug": "bacayao-norte",
    "barangay_name": "Bacayao Norte",
    "name_variants": [],
    "psgc_10_digit_code": "0105518001",
    "psgc_correspondence_code": "015518001",
    "urban_rural": "rural",
    "population_2024_popcen": 4043,
    "address": null,
    "trunkline": [],
    "website": null,
    "officials": [],
    "sources": ["psa-psgc-dagupan-2026q2"]
  },
  {
    "slug": "bacayao-sur",
    "barangay_name": "Bacayao Sur",
    "name_variants": [],
    "psgc_10_digit_code": "0105518002",
    "psgc_correspondence_code": "015518002",
    "urban_rural": "rural",
    "population_2024_popcen": 2856,
    "address": null,
    "trunkline": [],
    "website": null,
    "officials": [],
    "sources": ["psa-psgc-dagupan-2026q2"]
  },
  {
    "slug": "barangay-ii",
    "barangay_name": "Barangay II",
    "name_variants": [
      {
        "name": "Barangay II & III",
        "source": "dagupan-lgu-barangay-captains-2018-2020"
      }
    ],
    "psgc_10_digit_code": "0105518003",
    "psgc_correspondence_code": "015518003",
    "urban_rural": "urban",
    "population_2024_popcen": 2129,
    "address": null,
    "trunkline": [],
    "website": null,
    "officials": [],
    "sources": ["psa-psgc-dagupan-2026q2"]
  },
  {
    "slug": "barangay-iv",
    "barangay_name": "Barangay IV",
    "name_variants": [],
    "psgc_10_digit_code": "0105518004",
    "psgc_correspondence_code": "015518004",
    "urban_rural": "urban",
    "population_2024_popcen": 802,
    "address": null,
    "trunkline": [],
    "website": null,
    "officials": [],
    "sources": ["psa-psgc-dagupan-2026q2"]
  },
  {
    "slug": "bolosan",
    "barangay_name": "Bolosan",
    "name_variants": [],
    "psgc_10_digit_code": "0105518006",
    "psgc_correspondence_code": "015518006",
    "urban_rural": "urban",
    "population_2024_popcen": 3528,
    "address": null,
    "trunkline": [],
    "website": null,
    "officials": [],
    "sources": ["psa-psgc-dagupan-2026q2"]
  },
  {
    "slug": "bonuan-binloc",
    "barangay_name": "Bonuan Binloc",
    "name_variants": [],
    "psgc_10_digit_code": "0105518007",
    "psgc_correspondence_code": "015518007",
    "urban_rural": "urban",
    "population_2024_popcen": 11326,
    "address": null,
    "trunkline": [],
    "website": null,
    "officials": [],
    "sources": ["psa-psgc-dagupan-2026q2"]
  },
  {
    "slug": "bonuan-boquig",
    "barangay_name": "Bonuan Boquig",
    "name_variants": [],
    "psgc_10_digit_code": "0105518008",
    "psgc_correspondence_code": "015518008",
    "urban_rural": "urban",
    "population_2024_popcen": 15943,
    "address": null,
    "trunkline": [],
    "website": null,
    "officials": [],
    "sources": ["psa-psgc-dagupan-2026q2"]
  },
  {
    "slug": "bonuan-gueset",
    "barangay_name": "Bonuan Gueset",
    "name_variants": [],
    "psgc_10_digit_code": "0105518009",
    "psgc_correspondence_code": "015518009",
    "urban_rural": "urban",
    "population_2024_popcen": 24943,
    "address": null,
    "trunkline": [],
    "website": null,
    "officials": [],
    "sources": ["psa-psgc-dagupan-2026q2"]
  },
  {
    "slug": "calmay",
    "barangay_name": "Calmay",
    "name_variants": [],
    "psgc_10_digit_code": "0105518010",
    "psgc_correspondence_code": "015518010",
    "urban_rural": "urban",
    "population_2024_popcen": 6091,
    "address": null,
    "trunkline": [],
    "website": null,
    "officials": [],
    "sources": ["psa-psgc-dagupan-2026q2"]
  },
  {
    "slug": "carael",
    "barangay_name": "Carael",
    "name_variants": [],
    "psgc_10_digit_code": "0105518011",
    "psgc_correspondence_code": "015518011",
    "urban_rural": "urban",
    "population_2024_popcen": 6167,
    "address": null,
    "trunkline": [],
    "website": null,
    "officials": [],
    "sources": ["psa-psgc-dagupan-2026q2"]
  },
  {
    "slug": "caranglaan",
    "barangay_name": "Caranglaan",
    "name_variants": [],
    "psgc_10_digit_code": "0105518012",
    "psgc_correspondence_code": "015518012",
    "urban_rural": "urban",
    "population_2024_popcen": 5927,
    "address": null,
    "trunkline": [],
    "website": null,
    "officials": [],
    "sources": ["psa-psgc-dagupan-2026q2"]
  },
  {
    "slug": "herrero",
    "barangay_name": "Herrero",
    "name_variants": [
      {
        "name": "Herrero-Perez",
        "source": "dagupan-lgu-barangay-captains-2018-2020"
      }
    ],
    "psgc_10_digit_code": "0105518013",
    "psgc_correspondence_code": "015518013",
    "urban_rural": "urban",
    "population_2024_popcen": 1451,
    "address": null,
    "trunkline": [],
    "website": null,
    "officials": [],
    "sources": ["psa-psgc-dagupan-2026q2"]
  },
  {
    "slug": "lasip-chico",
    "barangay_name": "Lasip Chico",
    "name_variants": [],
    "psgc_10_digit_code": "0105518014",
    "psgc_correspondence_code": "015518014",
    "urban_rural": "rural",
    "population_2024_popcen": 1289,
    "address": null,
    "trunkline": [],
    "website": null,
    "officials": [],
    "sources": ["psa-psgc-dagupan-2026q2"]
  },
  {
    "slug": "lasip-grande",
    "barangay_name": "Lasip Grande",
    "name_variants": [],
    "psgc_10_digit_code": "0105518015",
    "psgc_correspondence_code": "015518015",
    "urban_rural": "rural",
    "population_2024_popcen": 2541,
    "address": null,
    "trunkline": [],
    "website": null,
    "officials": [],
    "sources": ["psa-psgc-dagupan-2026q2"]
  },
  {
    "slug": "lomboy",
    "barangay_name": "Lomboy",
    "name_variants": [],
    "psgc_10_digit_code": "0105518016",
    "psgc_correspondence_code": "015518016",
    "urban_rural": "rural",
    "population_2024_popcen": 1374,
    "address": null,
    "trunkline": [],
    "website": null,
    "officials": [],
    "sources": ["psa-psgc-dagupan-2026q2"]
  },
  {
    "slug": "lucao",
    "barangay_name": "Lucao",
    "name_variants": [],
    "psgc_10_digit_code": "0105518017",
    "psgc_correspondence_code": "015518017",
    "urban_rural": "urban",
    "population_2024_popcen": 10353,
    "address": null,
    "trunkline": [],
    "website": null,
    "officials": [],
    "sources": ["psa-psgc-dagupan-2026q2"]
  },
  {
    "slug": "malued",
    "barangay_name": "Malued",
    "name_variants": [],
    "psgc_10_digit_code": "0105518018",
    "psgc_correspondence_code": "015518018",
    "urban_rural": "urban",
    "population_2024_popcen": 9575,
    "address": null,
    "trunkline": [],
    "website": null,
    "officials": [],
    "sources": ["psa-psgc-dagupan-2026q2"]
  },
  {
    "slug": "mamalingling",
    "barangay_name": "Mamalingling",
    "name_variants": [],
    "psgc_10_digit_code": "0105518019",
    "psgc_correspondence_code": "015518019",
    "urban_rural": "rural",
    "population_2024_popcen": 1939,
    "address": null,
    "trunkline": [],
    "website": null,
    "officials": [],
    "sources": ["psa-psgc-dagupan-2026q2"]
  },
  {
    "slug": "mangin",
    "barangay_name": "Mangin",
    "name_variants": [
      {
        "name": "Manguin",
        "source": "dagupan-lgu-barangay-captains-2018-2020"
      }
    ],
    "psgc_10_digit_code": "0105518020",
    "psgc_correspondence_code": "015518020",
    "urban_rural": "rural",
    "population_2024_popcen": 5043,
    "address": null,
    "trunkline": [],
    "website": null,
    "officials": [],
    "sources": ["psa-psgc-dagupan-2026q2"]
  },
  {
    "slug": "mayombo",
    "barangay_name": "Mayombo",
    "name_variants": [],
    "psgc_10_digit_code": "0105518021",
    "psgc_correspondence_code": "015518021",
    "urban_rural": "urban",
    "population_2024_popcen": 8702,
    "address": null,
    "trunkline": [],
    "website": null,
    "officials": [],
    "sources": ["psa-psgc-dagupan-2026q2"]
  },
  {
    "slug": "pantal",
    "barangay_name": "Pantal",
    "name_variants": [],
    "psgc_10_digit_code": "0105518022",
    "psgc_correspondence_code": "015518022",
    "urban_rural": "urban",
    "population_2024_popcen": 17033,
    "address": null,
    "trunkline": [],
    "website": null,
    "officials": [],
    "sources": ["psa-psgc-dagupan-2026q2"]
  },
  {
    "slug": "poblacion-oeste",
    "barangay_name": "Poblacion Oeste",
    "name_variants": [],
    "psgc_10_digit_code": "0105518023",
    "psgc_correspondence_code": "015518023",
    "urban_rural": "urban",
    "population_2024_popcen": 4563,
    "address": null,
    "trunkline": [],
    "website": null,
    "officials": [],
    "sources": ["psa-psgc-dagupan-2026q2"]
  },
  {
    "slug": "barangay-i",
    "barangay_name": "Barangay I",
    "name_variants": [],
    "psgc_10_digit_code": "0105518024",
    "psgc_correspondence_code": "015518024",
    "urban_rural": "urban",
    "population_2024_popcen": 663,
    "address": null,
    "trunkline": [],
    "website": null,
    "officials": [],
    "sources": ["psa-psgc-dagupan-2026q2"]
  },
  {
    "slug": "pogo-chico",
    "barangay_name": "Pogo Chico",
    "name_variants": [],
    "psgc_10_digit_code": "0105518025",
    "psgc_correspondence_code": "015518025",
    "urban_rural": "urban",
    "population_2024_popcen": 3666,
    "address": null,
    "trunkline": [],
    "website": null,
    "officials": [],
    "sources": ["psa-psgc-dagupan-2026q2"]
  },
  {
    "slug": "pogo-grande",
    "barangay_name": "Pogo Grande",
    "name_variants": [],
    "psgc_10_digit_code": "0105518026",
    "psgc_correspondence_code": "015518026",
    "urban_rural": "rural",
    "population_2024_popcen": 1941,
    "address": null,
    "trunkline": [],
    "website": null,
    "officials": [],
    "sources": ["psa-psgc-dagupan-2026q2"]
  },
  {
    "slug": "pugaro-suit",
    "barangay_name": "Pugaro Suit",
    "name_variants": [
      {
        "name": "Pugaro",
        "source": "dagupan-lgu-barangay-captains-2018-2020"
      }
    ],
    "psgc_10_digit_code": "0105518027",
    "psgc_correspondence_code": "015518027",
    "urban_rural": "urban",
    "population_2024_popcen": 5389,
    "address": null,
    "trunkline": [],